,Date,Tweet
0,2020-12-15 17:32:53,virtual reality effective training lucid dreaming according scientific study 
1,2020-12-15 17:32:40,prime studios helps brands connect emotionally audiences designing customized visual experiences d visualization visual effects video production virtual reality visit 
2,2020-12-15 17:32:10,we use remote crawler camera discover whatxexxs beneath home provide virtual reality goggles yourself 
3,2020-12-15 17:31:19,imagine virtual reality amazingfeeling like running halls wow thatll level
4,2020-12-15 17:30:52,brain dance virtual reality simulator
5,2020-12-15 17:30:44,look future headset here look best ones availablen
6,2020-12-15 17:30:25,virtual reality effective training lucid dreaming according scientificxcxastudy 
7,2020-12-15 17:30:21,kiyoshi kurosawas contemplative critical melodrama travelogue travelogue tale fabrications reality tv effect fabricators xexxxcxarichard brody new yorkernnarea premiere to the ends of the earth opens friday xexx 
8,2020-12-15 17:29:06,save xcxa ultimate virtual reality gaming experience 
9,2020-12-15 17:27:14,read the fourth transformation rapid migration virtual amp augmented reality 
10,2020-12-15 17:27:13,the activity line nsip paintngames virtual reality partynstar performancesnbody art tottoosnfashion pop free younth december xfxfxxaxfxfxxaxfxfxxaxfxfxxaxfxfxxa 
11,2020-12-15 17:26:22,can virtual reality help anxiety learn entrepreneur making app try pm pt  pm et 
12,2020-12-15 17:25:03,brand new in hand factory sealed oculus quest virtual reality headset gb 
13,2020-12-15 17:24:20,join cynthia amp john today episode the paincancer connection interview entrepreneur celine tien development virtual reality app helps manage anxiety stress wellness challenges 
14,2020-12-15 17:23:45,virtual reality how technology improve neurorehabilitation nneeg technique widely brain machine interface research vr research measure engagement patients experiment n nn
15,2020-12-15 17:22:56,caexexxs aftermarket services team pleased offer new training format stay xexx online virtual training this economic solution adapted reality training needs looking elevate skills contact pdstrainingcom today n 
16,2020-12-15 17:19:40,looking new gaming laptop play latest virtual reality here handpicked vr ready laptopsnn 
17,2020-12-15 17:19:35,im overwhelmed game i barely understand it im nightclub getting job strapped thing head shit virtual reality nnmy biggest complaint i dont know what the fuck is happening 
18,2020-12-15 17:18:36,team virtual reality clips virtual reality clips xfxfxfxxfxfxfxxfxfxfx
19,2020-12-15 17:17:36,what is virtual reality training and what are its advantages 
20,2020-12-15 17:15:51,drinks virtual reality december   pm londonnn created new reality optimized teamwork collaborationnnwe partnered offer complimentary dinnerdrinksnnin order join need compatible vr headset 
21,2020-12-15 17:11:26,virtual reality shirley
22,2020-12-15 17:10:19,xexxctherexexxs program solves issues problemsxexxd pazen said xexxc isnxexxt cure challenges face itxexxs solutionxexxd 
23,2020-12-15 17:04:57,a new educational painting vr training system innovation center  our new educational painting vr system highly adaptable virtual reality training simulator mimics fully customized painting coating 
24,2020-12-15 17:04:22,tech likes think solution domestic workers looking safety solidarity but showed reality far complicated 
25,2020-12-15 17:03:07,taking favourite technology immersive  xfxfxxd n 
26,2020-12-15 17:03:03,a virtual reality bookshop authors publishers readers 
27,2020-12-15 17:03:00,spatial now lets you add apple iphone ipad amp android devices its virtual collaboration experience ar 
28,2020-12-15 17:01:42,excited chairing responding wonderful ajs panel virtual reality jewish history minutes 
29,2020-12-15 17:00:57,tomorrow on the news resident hiker totally neglects anime but in virtual reality more at 
30,2020-12-15 17:00:45,when discuss future immersive organizations its clear wexexxre midst transformative shift  traditional digital from binary hybrid nimmersive technologies virtual reality bridge n 
31,2020-12-15 17:00:09,not year old brother getting new iphone laptop inch tv ps type virtual reality game chain shit cost i didnxexxt ask yearxfxfxx people i spoil daughter xfxfxxbxfxfxx
32,2020-12-15 17:00:02,new connected services growing popularity including connected home ultrahigh definition streaming virtual reality 
33,2020-12-15 17:00:01,while playing virtual reality games feel like having little worldif arenxexxt able enjoy latest technology games switch high performance hostingnn 
34,2020-12-15 16:59:36,ixexxd want buy ticket there not virtual reality actually not possible though ixexxm nearly years late xfxfxaxa
35,2020-12-15 16:57:03,thunderbird school global management asu celebrates december graduates virtual reality avatar robots holographic commencement speakers awards delivered axcxadrone 
36,2020-12-15 16:55:12,oh ixexxm knowing virtual reality type shit coming 
37,2020-12-15 16:49:05,k ss house way santaxexxs sleigh xfxfxex thanks mrs wells st virtual reality field trip 
38,2020-12-15 16:48:52,how future emergency training shaped current pandemic 
39,2020-12-15 16:48:05,its like youve created virtual reality youre right who needs factslogic lets hate person i said so
40,2020-12-15 16:46:53,interplay learning featured emerging startup virtual reality this list recognizes topmost companies virtual reality globe 
41,2020-12-15 16:46:23,raw data vr xcxb k virtual reality gameplay 
42,2020-12-15 16:46:09,awesome winter  join interview newsweekn
43,2020-12-15 16:44:42,how virtual reality is helping us learn in lockdown 
44,2020-12-15 16:44:30,online classrooms are now a xexxcvirtualxexxd reality healthcare providers 
45,2020-12-15 16:42:09,and love god its called virtual reality all arent real dont granted all vent things cant say all ways escapism dont think thats normal thing forget live
46,2020-12-15 16:41:55,after making heartbreaking decision postpone virtual reality performances petrichor were thrilled confirm experience come coliseum friday saturday march nnall original tickets remain valid 
47,2020-12-15 16:41:27,yes home hologram saved image virtual reality projection 
48,2020-12-15 16:40:09,wondering do manikins immersive virtual reality simulation complement each other read post cc 
49,2020-12-15 16:38:54,oculus vr quest  a great vr headset xfxfxxennheading virtual reality world different xfxfxxbxefxbxfnnhave experienced virtual reality worldnnthe link comment sectionnn xexxa
50,2020-12-15 16:38:04,will parade vaccine nor virtual realitynif mps meet winter session december expect women men uniform march social distancing 
51,2020-12-15 16:37:13, busy december virtual reality come learn upcoming activities starting later monthnn xexbxbexexfxafxexxba xexbaxacxexxbaxexxbbxexxaxexxab xexxaxexxaxexxbxexxfxexxb xexxbxexxbxexxxexxaxexbxdxexaxenn
52,2020-12-15 16:36:47,loneliness myth realitynnvirtual work home future enhanced notion lonelinessnnhow tackle loneliness worknndont forget like share subscribe channelnn n
53,2020-12-15 16:36:36,crimedoor app lets users step highfidelity virtual representations  true crime scenes world including iconic crimes john lennon nicole brown simpson ted bundys victimsnn nn
54,2020-12-15 16:34:31, imho peloton best virtual reality experience anyones built not its high fidelity it isnt experience bike here good studio nyc trainer others
55,2020-12-15 16:33:53,governmentallotted orgasms prescribed virtual reality fulfilled machinesnnbut jk meets man line sneaks fingers edge sleeve touch bare skin cums spot skin skin
56,2020-12-15 16:33:18,great talk gt reality lab lectures philip rosedale  vr virtual worlds 
57,2020-12-15 16:32:13,patience virtual reality experience
58,2020-12-15 16:31:58,like escape reality virtual friends stupid things share data important share videos playing guitar us
59,2020-12-15 16:30:42,and evidence keeps pouring  amp 
60,2020-12-15 16:30:14,the new advanced faro zone d creates custom virtual reality scenarios experts turn scanned scene training exercise photos measurements pick evidence swab dna samples learn more nn 
61,2020-12-15 16:28:04,behind scenes tori blackxexxs virtual reality porn debut 
62,2020-12-15 16:27:03,i run virtual reality dating network where you can have sex marry 
63,2020-12-15 16:25:51,that cash recent capital raises burning hole andys pocket plug power buying virtual reality glasses teach technicians forklift fuel printed instructions paper sufficed plugnn 
64,2020-12-15 16:25:07,we dont adjust virtual reality we open like normal normal times stop fraud restart brain
65,2020-12-15 16:22:46,artsteps created custom reality booths economy forum quick switch present sponsors online virtual booth 
66,2020-12-15 16:20:04,online training seminars teachers childrennvirtual reality spanish class children nwednesday december th  pm  pm estnvia zoomnclassprogramorgnxcxbol 
67,2020-12-15 16:18:38,where virtual care was already reality experiences nationwide telehealth service provider during covidxcxapandemic 
68,2020-12-15 16:17:15,loneliness myth realitynnvirtual work home future enhanced notion lonelinessnnhow tackle loneliness worknndont forget like share subscribe channelnn xexxa 
69,2020-12-15 16:17:15,where virtual care was already reality experiences nationwide telehealth service provider during covid pandemic 
70,2020-12-15 16:17:09,big news major renovations complete shortterm rehabilitation facility our topranked center allnew stateoftheart equipment xexx including virtual reality platform xexx beautifully redesigned space 
71,2020-12-15 16:15:19,this fascinating augmented reality vr reimagination space limits virtual vs physical realityies possibilities propaganda omg look xfxfxxb
72,2020-12-15 16:14:03,spatial now lets you add apple iphone ipad amp android devices its virtual collaboration experience ar 
73,2020-12-15 16:12:00,osso vr marshall university joan c edwards school medicine partner advance rural medicine using virtual reality 
74,2020-12-15 16:10:48,the reality virtual temporarily new inperson its understatement its essential coworking providers possess innovative amp attractive virtual product offeringsnnour members virtual office offerings 
75,2020-12-15 16:10:32,virtual reality aampe
76,2020-12-15 16:10:32,the oculus quest will make every guy love virtual reality 
77,2020-12-15 16:10:31,online classrooms are now a xexxcvirtualxexxd reality healthcare providers 
78,2020-12-15 16:10:02,register jan virtual event zero trust xexx hear agency it leaders discuss successes challenges moving zerotrust architecture fits new reality remote workforce 
79,2020-12-15 16:08:12,virtual reality por favor
80,2020-12-15 16:08:10,our new rooms open business escape reality little enjoy cool gaming experience 
81,2020-12-15 16:07:35,vresorts launches virtual reality booking platform 
82,2020-12-15 16:05:12,with coronavirus disrupting everything people virtual reality things donenn 
83,2020-12-15 16:04:28,we want relief want country open want businesses open making money children school learning social skills experiencing human beings instead virtual reality
84,2020-12-15 16:02:38,could turn virtual rac investigatexfxfxx 
85,2020-12-15 16:02:00,whatxexxs pisces thing ixexxve ask saw ad virtual reality headset night bought immediately regrets
86,2020-12-15 16:01:23,chronic stress negatively impacts physical amp  wexexxre excited introduce centeredvr new virtual reality program help reduce chronic stress developed dr neda gould available program 
87,2020-12-15 16:01:22,balenciaga staged dystopian autumnwinter collection virtual reality runway presented oculus glasses 
88,2020-12-15 16:01:22,according vogue balenciaga staged dystopian autumnwinter collection virtual reality runway presented oculus glassesn 
89,2020-12-15 16:00:47,see lena takes d sketch uses alias create vrxexxs sketching subdivision surface tools draw dragon virtual realityxfxfxxbxfxfxxdnnfor story check design studio blog 
90,2020-12-15 16:00:21,to help open all introduced new virtual reality checks focused aspects accessible design learn vrcs resources building inclusive experiences 
91,2020-12-15 15:59:17,a review applications virtual reality augmented reality mixed reality surgical simulation an extxexxa 
92,2020-12-15 15:58:34,virtual reality uses daily life gadgetpiper 
93,2020-12-15 15:56:49, we the netherlands confined home nnow turn focus outside inside free virtual realitynnhow to awaken from the matrix using selfenquirynnxfxfxx 
94,2020-12-15 15:55:53,new study reveals virtual reality skills training is poised explosive growth by 
95,2020-12-15 15:54:52,new study reveals virtual reality skills training is poised explosive growth by n  
96,2020-12-15 15:54:47,my new video hot check out 
97,2020-12-15 15:53:58,online classrooms are now a xexxcvirtualxexxd reality healthcare providers nanette koch 
98,2020-12-15 15:48:43,ticket broker dalali ur profession n ur expertise politics virtual reality u r broker
99,2020-12-15 15:47:34,youxexxre listening idiocy govs taking away right live life fit i wanna privy secret information tangible fight america you living life virtual reality w q doesnxexxt help us
100,2020-12-15 15:45:33,when strict shutdown bans international travel clear reality tour guide jeremy realized think outside box 
101,2020-12-15 15:45:11,experience future gaming hamilton countyxexxs standalone virtual reality arcade explore games escape rooms today noblesville chamber member derezzed vrn 
102,2020-12-15 15:45:03,news virtual reality applied rehabilitation stroke neurodegenerative disease patients  
103,2020-12-15 15:42:48,zerone vr virtual reality glasses  wearyourowntechs 
104,2020-12-15 15:41:51,thanks cc also love places i enamored virtual space real one in warcraft friends teleported dalaran long i level i joyous sensation emerging subway akihabara tokyo reality
105,2020-12-15 15:39:26,comes virtual reality 
106,2020-12-15 15:38:47,virtual reality
107,2020-12-15 15:38:00,register jan virtual event zero trust xexx hear agency it leaders discuss successes challenges moving zerotrust architecture fits new reality remote workforce 
108,2020-12-15 15:35:40,i do im llc gaming i stream virtual reality 
109,2020-12-15 15:35:01,virtual reality d vr headset 
110,2020-12-15 15:30:40,a systematic review immersive virtual reality applications higher education design elements lessons learned research agendanjaziar radianti amp xfxfxxaxcxamxfxfxaxabeduckaccixcxn red 
111,2020-12-15 15:30:15,allows brands provide customers unique engaging experiences combine xexxrealxexx elements changing game main choices marketsnnthe benefits marketing 
112,2020-12-15 15:30:07,problem knows virtual reality tools created students view mars nproviding access students helping educate important 
113,2020-12-15 15:27:51,imagine vr old republic game awesome experience coruscant korriban virtual reality
114,2020-12-15 15:26:08,new virtual reality projects allow people experience racism firsthand 
115,2020-12-15 15:25:15,the eyesi slit lamp highend diagnostic training amp  its virtual reality technology integrated original hardware haagstreit bq slit lamp model amp offers functions real slit lamp 
116,2020-12-15 15:24:01,a new year us are excited innovations virtual reality years come 
117,2020-12-15 15:23:02,well appears i beat i mustxexxve received king vaccine tomorrow i synced w and wife created yesterday order hook wifi amp restore virtual reality yearnyouxexxre welcomennanu nanuxfxfxxxfxfxfxbb
118,2020-12-15 15:21:37,plus stuff straight outta black mirror except virtual reality simulate dating environment nblack mirror nearly stop internet
119,2020-12-15 15:21:34,be kansas cityxexxs iconic skyline take interactive virtual tour town pavilion th main downtown  reach ryan biery space reality organization 
120,2020-12-15 15:21:19,what ixexxve learned twitternot cries needs help they need just you what ixexxve learned virtual reality blue checks impact real checks real world 
121,2020-12-15 15:21:02,verizon teaming simon fuller legendary creator american idol franchise transform storytelling entertainment g virtual reality vr extended reality xr 
122,2020-12-15 15:18:40,the eyesixcxae highend virtual reality simulator intraocular training developed vitreoretinal  find 
123,2020-12-15 15:18:05,virtual reality technology change future marketing land looks awesome  see the big moneymaker
124,2020-12-15 15:17:10,did virtual plein air painting google earth vr stream yes painting virtual reality it super funnn 
125,2020-12-15 15:16:35,that time i went the void blizzcon virtual reality essentially walking ramps blindly id wheelchair months nbonus extreme sparsity hairnbonus bonus 
126,2020-12-15 15:15:00, trains crew plans develop programs replace 
127,2020-12-15 15:13:56,but kids preoccupied social media risktaking behavior comes adolescence virtual realm reality
128,2020-12-15 15:13:14,new virtual reality projects allow people experience racism firsthand 
129,2020-12-15 15:12:12,struggling minutes feeling sick dont worry youre alone learn virtual reality motion sickness amp stop itbefore its late xfxfxaxa 
130,2020-12-15 15:10:44,virtual reality brightening
131,2020-12-15 15:10:15,explore stockholm through virtual reality 
132,2020-12-15 15:06:58,new virtual reality projects allow people experience racism firsthand 
133,2020-12-15 15:05:01,a christmas carol the little theatre alexandrianan unusual a christmas carol unusual times timeless holiday classic presented live acting animationand virtual reality to info tickets 
134,2020-12-15 15:04:37,its walking device virtual reality headset
135,2020-12-15 15:04:00,thunderbird school global management asu celebrates december graduates virtual reality avatar robots holographic commencement speakers awards delivered axcxadrone 
136,2020-12-15 15:03:41,how virtual reality is helping us learn in lockdown 
137,2020-12-15 15:03:19,increasing vr virtual reality digital hacking mean literally cant believe eyesnnare entering new era sensemakelearn
138,2020-12-15 15:03:17,applications of virtual reality for restaurant brands 
139,2020-12-15 15:01:51,osso vr raises  million bring surgical medical device training xfxfxxfn n 
140,2020-12-15 15:00:55,you cant cant see now vr opening new possibilities children dont equal access experiences importantly gives sense empathy vitally need future nnn
141,2020-12-15 15:00:45,the tent making christianity podcast  virtual reality church 
142,2020-12-15 15:00:11,now your primary job todayxexxs complex reality successfully join learn hown register at 
143,2020-12-15 15:00:03,no need forxfxfxxbas step inside galleries private reality nxfxfxx n 
144,2020-12-15 15:00:01,virtual augmented amp mixed reality technologies xr changing manufacturing how manufacturers adopting amp embracing new technology nnjoin representatives bmw amp sify technologies discuss journey trends amp best practicesnn 
145,2020-12-15 14:59:46,delving new world partner board reassuring spiritually healing i truly appreciated itxexxbaxefxbxfnnplus experience  gonna streaming often nn xexbxbdxexaxbxexbaxaxexbx xexxdxexbfxa 
146,2020-12-15 14:57:09,virtual reality porn
147,2020-12-15 14:57:01,verizon teaming simon fuller legendary creator american idol franchise transform storytelling entertainment g virtual reality vr extended reality xr 
148,2020-12-15 14:56:26,check scene d virtual reality sketchfabnn  th day challenge n 
149,2020-12-15 14:52:24,at years old mm nanolumens xexxs learning center vibrant amp reliable power virtual reality content really check evolution amp client repurposed times  
150,2020-12-15 14:47:27,looking virtual conversation tonight join tonight pm explore social safety warmth home 
151,2020-12-15 14:46:46,xfxfxxxfxfxxnfeel like ive member yearsncant wait kids need help setting fancy hologram type virtual reality theyll years
152,2020-12-15 14:46:19,virtual reality xexx vr  ar specialization free wor  technology karachi sd 
153,2020-12-15 14:46:00, cutting cost reducing isolation attracting talent 
154,2020-12-15 14:44:38,how virtual reality is helping us learn in lockdown 
155,2020-12-15 14:44:37,how virtual reality is helping us learn in lockdown 
156,2020-12-15 14:44:24,at years old mm nanolumens xexxs learning center vibrant amp reliable power todayxexxs virtual reality content really check evolution amp client repurposed times  
157,2020-12-15 14:44:08,a haiku members wrote virtual creative writing workshopncreative writingnescape realitynexpressing thoughtsnif live wolves like group need help mental health contact infoorguk 
158,2020-12-15 14:43:29,in years cats virtual reality nervous leave house what exciting time be what next xfxfxaxbxfxfxfxbcxfxfxaxxfxfxcxbbxfxfxdxbe
159,2020-12-15 14:39:55,a virtual reality social life 
160,2020-12-15 14:39:39,ixexxm scared these i hate virtual reality games lol 
161,2020-12-15 14:38:55,spinoffs benefit students airplane passengers manufacturers more for example collaborated create virtual reality tool based decades research allows students tour mars right homes 
162,2020-12-15 14:30:23,the bizarre amp intense virtual reality game youxexxll experience stars xfxfxxafxexcxaxexadxxefxbxf 
163,2020-12-15 14:24:14,augmented reality virtual reality 
164,2020-12-15 14:23:42,southport architects clayton architecture limited vr virtual reality allow people walk through new homes extensions businesses lookn nn
165,2020-12-15 14:23:07,if want virtual reality meeting watch 
166,2020-12-15 14:22:03,augmented reality virtual reality 
167,2020-12-15 14:21:08,spatial systems inc holographic collaboration platform augmented reality virtual reality today announced native ar app ios android runs current generation mobile device during covid pandemic 
168,2020-12-15 14:20:53,maplewood senior livingxexxs brian geyser value virtual reality  
169,2020-12-15 14:19:35,strong internal cwb culture built nbringing local business virtual christmas market support local economynbrings concept cwb reality lighting touch paper staff businessn 
170,2020-12-15 14:18:58,unfortunately perception reality times this cultivating personal brand important this covered virtual catalyst would love hear thoughts this you 
171,2020-12-15 14:18:07,yearold man experiences virtual reality riftingreality
172,2020-12-15 14:17:48,they need brains drilled help control safetynnxexxctodayxexxs external devices xexx wearable computers virtual reality headsets xexx certainly implantable bodies brainsxexxdnklaus schwab 
173,2020-12-15 14:17:46,in study evaluated immersive virtual reality workplace training researchers discovered learners given opportunity practice disassembling machine ivr difficulties real life training 
174,2020-12-15 14:15:56,vr christmas shopping stressful lot safer especially amid global health crisis n 
175,2020-12-15 14:15:04,launches centeredvr reduce chronic workforce stress 
176,2020-12-15 14:12:21,spatial lets add iphone ipad amp android devices virtual collaboration experience ar 
177,2020-12-15 14:10:57,later on the news homeless man totally neglects anime but in virtual reality coming up at 
178,2020-12-15 14:10:29,virtual reality sire
179,2020-12-15 14:10:17,our ceo professor cathy craig live rise spotlight discussing benefits virtual reality immersive training profiling register event below 
180,2020-12-15 14:10:13,we excited professor damon clark st guest speaker inaugural winter stem academic boot camp heres link professor clarks recent researchnn cool apply now 
181,2020-12-15 14:09:00,axios recreating racism vr fight real racism  
182,2020-12-15 14:07:43,news the running virtual reality simulation module uk engineering students taught entirely n
183,2020-12-15 14:06:02,bring amid 
184,2020-12-15 14:06:00,abbott launches first optical coherence tomography vr training program cardiologists nnthis help cardiologists cath lab staff train scenarios havent seen real life improve patient carenn n
185,2020-12-15 14:04:32,relax bhai way shattered dream  and dream lifetime issues enjoy illusion way its virtual reality era enjoy fantasy xfxfxx
186,2020-12-15 14:03:18,janet jackson was  honest in my virtual reality dream conversation with her at a house eating among others about one week ago 
187,2020-12-15 14:02:52,the worlds virtual designer showhouse include augmented reality debuted nnto learn navigate it click herenn nnto tour play augmented reality products homenn 
188,2020-12-15 14:01:43,icymi how virtual reality help cardiologists treat coronary artery disease 
189,2020-12-15 14:00:03,global virtual reality device market growth manufacturing sector coronavirus  
190,2020-12-15 14:00:00,hour your primary job todayxexxs complex reality successfully join learn hown register at 
191,2020-12-15 13:59:24,did you knownnintendoxexxs virtual boy pseudovirtualreality headset gave users severe headaches motion sickness spent year market 
192,2020-12-15 13:58:59,we think life net matters nvirtual reality insane lol
193,2020-12-15 13:50:00,what digital world like future our secondary year students brains telde arenxexxt picturing it theyxexxre creating virtual reality workshop great work xfxfxxc 
194,2020-12-15 13:49:40,ava where virtual meets reality no th week  top films weekn 
195,2020-12-15 13:48:25,virtual reality training lucid dreaming 
196,2020-12-15 13:47:22,i able add cart 
197,2020-12-15 13:45:42,successful concert single goin crazynnhistoric st virtual reality concert philippines ntop songs philippines ntop goin crazy nncongratulations xfxfxxfnngood job a team xfxfxxaann 
