,Date,Tweet
2589,2020-12-13 19:32:32,new sealed gb oculus quest xexx in hand allinone virtual reality headset 
2590,2020-12-13 19:30:09,reality gaming group coinify partner doctor who virtual currency paymentsnnread morenn nn
2591,2020-12-13 19:30:09,lmao aqua h wanting disconnect reality form superficial friendships lives virtual world xfxfxx
2592,2020-12-13 19:25:08,thinking virtual reality experience design course expand learning anyone good recommendations note  ixexxm looking development courses 
2593,2020-12-13 19:24:56,then xfxfxx self like letxexxs play jumanji style virtual reality game my mind literally fucking right now know happens play sucked game like thrown virtual reality game xfxfxaxa
2594,2020-12-13 19:24:16,vr technology important technologys futurennnot virtual reality k  k vr videos
2595,2020-12-13 19:23:51,ooh la la breezy hills newest inventory home movein readyxexexa ridgecross drive sq ft bed bath stop today  pm take a virtual tour additional detailsnxexexa 
2596,2020-12-13 19:22:00,to effectively scale investments organizations need empowered right skills find ey digital investment index report help leaders understand improve strategy amp enhance roi 
2597,2020-12-13 19:19:22,ahh wow strange listen ur self talk pretty funkin weird but ask u direct questions amp u r trying remember ur reality u actually living virtual suspended animated world time check sheet out bootsy babyxfxfxaxa 
2598,2020-12-13 19:15:03,i dont think thats meant virtual reality
2599,2020-12-13 19:13:21,maybe virtualnreality protests of betternyet temporary ban onnpublic protest especially nwhen angry crowd beatnon carsn n 
2600,2020-12-13 19:12:55,vicast franchisennannouncing new rebranded franchise vicast vicast virtual reality entertainment aiming connect virtual entertainment public audience vicast presents indie vtubers gamers esports catering streamers 
2601,2020-12-13 19:12:38,gliese cc k steroscopic virtual reality experience created  nenter world xexexa
2602,2020-12-13 19:10:36,i feel like crap leading virtual reality situation like player one
2603,2020-12-13 19:10:19,virtual reality batteries
2604,2020-12-13 19:09:44,social workers virtual reality experience lives children care 
2605,2020-12-13 19:03:32,i dont believe virtual realitynat im trying
2606,2020-12-13 19:02:28,sr helena burns virtual reality theology body 
2607,2020-12-13 19:01:09,reality gaming group coinify partner doctor who virtual currency paymentsnnread morenn nn
2608,2020-12-13 19:00:45,everyday inspires continue working virtual reality unity
2609,2020-12-13 19:00:38,cyberpunk scifi virtual reality escape room people you separate safe real world see hear work virtual world use augmented abilities escape exclusive futuristic experiencennbook online 
2610,2020-12-13 19:00:20,virtual reality days youve probably wondered vr games made well thatnnn 
2611,2020-12-13 18:56:47,can virtual reality 
2612,2020-12-13 18:56:28,xfxfxxaf really breaking bad well im planning again fact xfxfxx its great wo enoughnthe graduate i liked laugh heartily ending criminalnought reshot virtual reality xfxfxx
2613,2020-12-13 18:54:07,firstever finnair virtual reality flight santa delivers magic festive  
2614,2020-12-13 18:52:51,plot twistnnturns beethoven dorian gray actually anne rice virtual reality simulation
2615,2020-12-13 18:52:27,advanced technology comes bodynhairxexxa antennasneyesxexxa camerasnearsxexxa satellites nnosexexxa sensorsnheartxexxa generator nbrainxexxa computernnpineal glandxexxa virtual realityn xfxxbxb
2616,2020-12-13 18:50:12,virtual visit meetings day common physical meetings with covid climate change industry  year likely momentnn
2617,2020-12-13 18:49:49,a new framework needed enable healthcare organizations orchestrate myriad interconnected changes required amp sustain virtual care nntech harnessed benefit patients amp supported new skills needed transform experiencesnn
2618,2020-12-13 18:47:07,i developing feelings texts stupid n they talking thinking youre specialn its like virtual thing reality different physical presence needed
2619,2020-12-13 18:41:14,if experience virtual reality experience ncheck spark nora young cbc listen shared cbc listen app android
2620,2020-12-13 18:40:38,warned better deranged physcotic physco paths internal body turn fking criminal virtual reality crimes software programs off hell w showing tongue icon phone get hell off now
2621,2020-12-13 18:39:55,social workers virtual reality experience lives children care 
2622,2020-12-13 18:38:00,an indianapolis youth group virtual reality continue providing new experiences kids covid pandemic 
2623,2020-12-13 18:36:16,dont things seriously bro just dont mix virtual things reality people know u support u dont stress let be
2624,2020-12-13 18:34:19,city enemy territory nmystic jungle eggmans facilityngreen hill virtual reality
2625,2020-12-13 18:33:27,alden richards makes history filipino artist stage virtual reality concert ph 
2626,2020-12-13 18:32:02,alternate reality  gain prominence amid pandemicnnthe new indian expressnnlast monthxcxasri sri ravi shankarxcxaheld virtual press conference announce benefits kabasura kudineer classical siddha formulationnn
2627,2020-12-13 18:31:10,have thinking virtual reality tools want learn more nn articulate ventures network explains basics vr turn join exploring space episode  nn 
2628,2020-12-13 18:30:36,anything tim keller recorded isnxexxt preaching redeemer nyc anymore john piper david platt francis chan ixexxve attending virtual church reality la liking it
2629,2020-12-13 18:29:36,were hiring click apply scientist  engineer virtual reality amp simulation  
2630,2020-12-13 18:27:40,woman digitizes universe graphically mapping virtual reality
2631,2020-12-13 18:27:18,sometimes world blue grey need white light upxfxfxxnreality virtual world changes according eyes itn 
2632,2020-12-13 18:25:04,using virtual reality  deepening learning traditional methods new medium 
2633,2020-12-13 18:24:21,the new attraction combine d augmented reality artificial intelligence virtual realitynn
2634,2020-12-13 18:24:13,rather succumbing despair eggnog theater companies instead turned performance capture audio drama livestream green screen shadow puppets virtual reality deliver festal entertainment 
2635,2020-12-13 18:23:20,it easy distracted notifications sure son understands risks fully immersive virtual reality app 
2636,2020-12-13 18:20:02,oculus sensor rift virtual reality headset xexx black 
2637,2020-12-13 18:15:09,qampa maplewood livingxexxs brian geyser value reality  healthtech magazine 
2638,2020-12-13 18:10:16,virtual reality torment
2639,2020-12-13 18:09:09,this fun lots weird stuff it virtual reality animatronics rap battles dance battles how lawyer olympics i dont know i dont care theyre lots fun 
2640,2020-12-13 18:05:42,limited stockxfxfxxb virtual reality d vr headset xfxfxaxbfree shipping worldwidexfxfxaxa buy here n 
2641,2020-12-13 18:05:06,nhello world gofundme campaign best educational virtual reality vr software kindly click link render help donating campaign 
2642,2020-12-13 18:04:05, innovation shifting virtual augmented reality audio video conversations 
2643,2020-12-13 18:02:08,the new games insidelike virtual reality
2644,2020-12-13 18:00:53,reality watching virtual version it
2645,2020-12-13 18:00:24,he meant zimbabwe xbox gamena virtual reality state
2646,2020-12-13 18:00:01,joined forces virtual reality experience highlight importance forests amp protect themndownload mobile app experience journey xexexa 
2647,2020-12-13 18:00:00,icymi s  phd assistant professor  recently story published osu insightsnncheck xexxcgoing virtual unravel sports concussionsxexxc learn dr caccese uses virtual reality study concussions 
2648,2020-12-13 17:56:30,observing reality brainless no forcing play gacha game thousands forms entertainment market i agree lootboxes exploitative metaphors like dont mean anything talk science it virtual hunger
2649,2020-12-13 17:52:54,zizzo wilkerson home victories seasonopener virtual reality hot rod association   
2650,2020-12-13 17:52:48,sorry n virtual reality training why immersive environments create greater engagementn 
2651,2020-12-13 17:51:37,this aint grandmas tetrisnnvetrix live springboardvr marketplacennfrom friends  vetrix puzzle game inspired tetris original mechanics built virtual reality 
2652,2020-12-13 17:50:02,xexxaxexxcnobodyxexxs listeningxexxd virtual reality experienceart exhibition aims amplify voices survivorsaffected communities seeking justice for recognition yazidi genocide carried isil 
2653,2020-12-13 17:49:27,in world slowly reality virtual nxexx virtual actual prepared face challenges ur life 
2654,2020-12-13 17:46:36,do like virtual reality do kids did know read books virtual worldnncheck new immersive reality ir book collection we libraries country offer books 
2655,2020-12-13 17:46:18,an endless knight boxshaped virtual reality game hearts
2656,2020-12-13 17:43:08,in special education virtual reality augmented reality and artificial intelligencenn special education virtual reality augmented reality and artificial intelligence 
2657,2020-12-13 17:42:18,hololens augmented realitynnnot virtual mixed
2658,2020-12-13 17:40:52,the lazy socialist ctu xexxteachersxexx want stay home know virtual learning bad children they xexxitxexxs kidsxexx reality itxexxs teachers bloated pensions
2659,2020-12-13 17:39:23,just posted photo virtual reality 
2660,2020-12-13 17:38:23,remember going old pass day thatxexxs going matter experiences memories created reality virtual bullshit people thinking itxexxs xexxc life xexxc
2661,2020-12-13 17:31:42,virtual reality training why immersive environments create greater engagement cc 
2662,2020-12-13 17:30:10, a journey celebrities virtual reality blackmarket conspiracy ties high levels government officials
2663,2020-12-13 17:29:40,i played virtual reality boxing night caught 
2664,2020-12-13 17:25:01,beyond stars virtual reality documentary worldxexxs largest radio telescope array xexx square kilometre array ska australiann
2665,2020-12-13 17:20:57,tonight on the news confused girl lives in fear of anime but in virtual reality coming up at 
2666,2020-12-13 17:19:02,i birthday party virtual reality it awesome
2667,2020-12-13 17:17:19,new review  learn spanish vr steam vr  oculus rift only 
2668,2020-12-13 17:16:32,sensorium mubert develop aidriven djs virtual reality concerts  venturebeat 
2669,2020-12-13 17:16:19,dmd mars mission vr xcxb k virtual reality gameplay 
2670,2020-12-13 17:16:06,check scene d virtual reality sketchfabnn drink  th day challenge 
2671,2020-12-13 17:15:29,my mans skyrim i like spending time virtual reality rl xfxfxaxb
2672,2020-12-13 17:14:03,as consciousness thatxexxs i perceive right now ixexxm collective consciousness unit assigned pod thatxexxs virtual reality wexexxre rn
2673,2020-12-13 17:13:47,weve got exciting announcements share near future heres read waitnn second edition company blog iz potter talks virtual reality mean theatre
2674,2020-12-13 17:11:33,oculus sensor rift virtual reality headset xexx black with original box 
2675,2020-12-13 17:11:32,new hand oculus quest advanced allinone virtual reality headset gb 
2676,2020-12-13 17:10:43,virtual reality whilst
2677,2020-12-13 17:09:33,yup yup new challenge incoming nnwe released  how fast move nnhave got vifit xfxfxxb 
2678,2020-12-13 17:09:11,i skills acquired amp strengthened overtime daily practice safe virtual environment i long day come bring virtual reality gaming education
2679,2020-12-13 17:05:30,they spend incredible proportion lives virtual theyve confused real they think symbol manipulation determine reality its thing does
2680,2020-12-13 17:05:02,meet quest  fully standalone virtual reality headset equipped new faster processor increased performance advanced display  pixels original quest 
2681,2020-12-13 17:04:14,day virtual reality nintendogs day like live die walking chihuahua
2682,2020-12-13 17:00:46,new review  vr travelling thth century europe steam vr  valve index htc vive amp oculus rift 
2683,2020-12-13 17:00:16,were  space bodies virtual reality perception avatars
2684,2020-12-13 17:00:04,augmented reality virtual reality ar vr market size share status forecasts  
2685,2020-12-13 17:00:01,if time vr off youd think  it sure beats staring walls day as shared reality largely virtual people exploring new applications virtual realitynn
2686,2020-12-13 16:52:50,mini d virtual reality glasses 
2687,2020-12-13 16:51:22,anyone caught legal alcohol limit driving banned driving months fined xcxa its worth risk download app outcome bad decisions fully immersive virtual reality 
2688,2020-12-13 16:48:20,do research virtual reality amp medical industry collide 
2689,2020-12-13 16:48:01,vr math the difficulties moving objects virtual reality 
2690,2020-12-13 16:42:07,trumpxexxs favorite spielberg virtual reality movie ready individual one nn 
2691,2020-12-13 16:40:03, a recap npeople crave connectionnvirtual events current reality they offer opportunities wider audience reach online tools ensure measurablen 
2692,2020-12-13 16:29:51,working images xfxfxax ideas xfxfxxa virtual reality itxexxs lotta work man but i got this team tango welcome space wars xexaxxefxbxf 
2693,2020-12-13 16:29:09,regardless way humanity goes its hell galactic horizon virtual world place occupy happy long bodies handle it the virtual reality industry quantum industry are
2694,2020-12-13 16:27:10,i run virtual reality dating network where you can have sex marry 
2695,2020-12-13 16:26:08,now grok this y need bodies has covid taken childhoodxexxs end nthe virtual reality office 
2696,2020-12-13 16:26:07,postaugmented hypertelling dead its programmatic virtual reality now
2697,2020-12-13 16:25:09,virtual reality market current future demandxcxa 
2698,2020-12-13 16:20:02,in years time interested selfdriving cars sex robots probably passed xfxfxx nhow world look sex robots amp hrs day virtual reality 
2699,2020-12-13 16:16:16,a new world training nnget on board 
2700,2020-12-13 16:12:47,talking virtual reality headset
2701,2020-12-13 16:10:44,virtual reality words
2702,2020-12-13 16:10:06,prayer 
2703,2020-12-13 16:08:29,bitcoin solves problems dont exist yetnnone day  existence possessions concentrated virtual reality hosting company wont able delete existence like happened
2704,2020-12-13 16:06:02,oculus go gb standalone virtual reality headset  used excellent shape 
2705,2020-12-13 16:06:00,a water virtual reality game character looks like tiny sofa
2706,2020-12-13 16:04:39,reality obvs virtual for now virtual reality thatxexxd dope xfxfxxcxfxfxfxbc 
2707,2020-12-13 16:02:03,sharon koifman founder distantjob received oculus quest  virtual reality headset created oculus brand facebook technologies watch impression latest videoxcxann nn
2708,2020-12-13 15:59:30,yeah good thing catch decide let live kill them i dismembered them thatxexxs bad kid bd meaning brain dance basically virtual reality puts eyes person recording
2709,2020-12-13 15:58:37,i dont agree ntheyre virtual reality till real people them person streets me not people vested interests plus minus real affectees
2710,2020-12-13 15:56:53,sa gets new d online school children teachers interact avatars 
2711,2020-12-13 15:51:41,who knew covidsafe recruitment fun pwc replaced traditional careers fair virtual reality recruitment park students staff tour converse avatars read article 
2712,2020-12-13 15:51:01,virtual reality relationship game can share experiences vr fight games defend play volley ball tennis air hockey bow arrow game 
2713,2020-12-13 15:47:17,vs evo xfxfxx no disrespect champ maybe remake fight night round online since people inside wanna battle also ps controller turned controller virtual reality fighting test skills vr ready player one
2714,2020-12-13 15:44:33,the foods i love foods body longer tolerate ill interested i virtual realityxfxfxxb
2715,2020-12-13 15:41:50,a fascinating article creating map world allow build help augmented reality devices locate understand themn 
2716,2020-12-13 15:39:21,icymi les enfant terribles teamed virtual reality company livr present sherlock holmes online adventure blurs lines theatre gaming escape room board game read moregtgt 
2717,2020-12-13 15:36:51,this zspace worlds first virtualnn augmented reality innovative dnn laptopnntransforming learning designednn especially classrooms 
2718,2020-12-13 15:36:05,an ice magnet wild virtual reality game composed sinks
2719,2020-12-13 15:33:17,it i inadvertently got tools virtual reality production oh well time learn new stuff amazingnnnow i figure vr ubuntu best tower rig i boot multiple linux os anyone suggestion best 
2720,2020-12-13 15:30:51,firstever finnair virtual reality flight santa delivers magic festive  
2721,2020-12-13 15:30:00,according analysts  households vr do agree personally i think analysts think linear scale dont consider mix technologies imho littlenn nn 
2722,2020-12-13 15:26:34,new review  fire trump  air combat vr steam vr  htc vive amp oculus rift 
2723,2020-12-13 15:26:12,how cool this my spurs supporting elder brother virtual reality headset kane scorennhow uncool that as hammers fan weekly spurs consistency starting grind down when spurs well start playing like spurs ie bottle 
2724,2020-12-13 15:25:52,trump enjoyed cooperation capital reality  left gates us amp capital need defusing amp repression fascism provides trump canxexxt muster actual support power grab
2725,2020-12-13 15:22:03,fascinating when virtual reality ai mimic display facial expressions reducing cpu connectivity needs ixexxll inn 
2726,2020-12-13 15:20:44,wow virtual reality
2727,2020-12-13 15:20:18,avatars games theres huge sex industry japan men human females attractive anime cartoons attractive children escaping digital world real amp want life represent virtual reality 
2728,2020-12-13 15:20:04,if choice virtual reality festivals pick 
2729,2020-12-13 15:19:34, virtual realityxefxbcxxexxebookxexx xexxaxexxagt 
2730,2020-12-13 15:15:05,s pain neuroscience education virtual reality  psychologically informed physical therapy  contact informationnn 
2731,2020-12-13 15:13:38,new review  bodyless steam vr  valve index htc vive oculus rift amp windows mr 
2732,2020-12-13 15:13:20,great info plenty longterm investing opportunities upside themes  im positioning growth opportunities esg argumented virtual reality
2733,2020-12-13 15:12:36, looks female n existnall r screens completely created digitally augmented virtual reality people believe real 
2734,2020-12-13 15:12:10,epic femboy vr gamer seeing virtual reality
2735,2020-12-13 15:12:05,scientists unveil virtual reality tool covid drug development 
2736,2020-12-13 15:11:12,virtual reality steered
2737,2020-12-13 15:08:08,can virtual reality training teach cops empathy denver colorado police hope so 
2738,2020-12-13 15:07:02,is postlong form brand future postreal time virtual reality
2739,2020-12-13 15:05:06,alden richards makes history filipino artist stage virtual reality concert ph xexx manila bulletin 
2740,2020-12-13 15:04:52,virtual reality battlefield technology designed train military leaders 
2741,2020-12-13 15:04:34,twitter virtual reality dont let consume younwords marble 
2742,2020-12-13 15:01:43,alden richards makes history filipino artist stage virtual reality concert ph 
2743,2020-12-13 15:00:47,new review  metachromium steam vr  valve index amp htc vive 
2744,2020-12-13 15:00:16,allows brands provide customers unique engaging experiences combine xexxrealxexx elements changing game main choices marketsnnthe benefits marketing 
2745,2020-12-13 15:00:04,virtual augmented amp mixed reality technologies xr changing manufacturing how manufacturers adopting amp embracing new technology nnjoin representatives bmw amp sify technologies discuss journey trends amp best practicesnn 
2746,2020-12-13 14:58:10,it jaguarxexxs virtual reality driving simulator  balls measure head movements driving itxexxs designing cockpit layout minimises driver distraction
2747,2020-12-13 14:58:02,virtual reality changing way musicians able interact audiences use videos change way connect fans 
2748,2020-12-13 14:53:36,you guys life ntwitter virtual reality donxexxt let consume you
2749,2020-12-13 14:49:26,what virtual reality doctors appointment 
2750,2020-12-13 14:48:56,kinda hoping tuloy adaptation real account too kaloka naalala ko i scared reading kasi revolves virtual world  die followers die reality xfxfxxxfxfxxxfxfxxxfxfxx
2751,2020-12-13 14:46:34,virtual reality how technology improve neurorehabilitationnn
2752,2020-12-13 14:36:01,xexxcthese tools content meaningful tangible fun students says roberta freitas education technology coordinator nhow augmented reality virtual assistants strike balance innovation safetyn
2753,2020-12-13 14:34:02,i gonna sight seeing virtual reality 
2754,2020-12-13 14:32:00,years realism photorealism virtual reality exhibition 
2755,2020-12-13 14:29:35,cannabis way go technology like virtual reality
2756,2020-12-13 14:27:11,mini d virtual reality glassesnnnn nn 
2757,2020-12-13 14:23:56,sa gets new d online school children teachers interact avatars n 
2758,2020-12-13 14:23:13,thomas campbell  it virtual reality nnout body experienes tom campbell
2759,2020-12-13 14:22:52,dont chase men hexexxs  xexx korean figure skater jakeys biggest fanboy whoxexxs terrified virtual reality named park sunghoon u catch running damn marathon
2760,2020-12-13 14:22:22,do noodle things dragon things lizard things but virtual reality xfxfxxb
2761,2020-12-13 14:21:02,new oculus quest advanced allinone virtual reality headset gb 
2762,2020-12-13 14:20:56,thats genius especially virtual reality stimulation i wondered like this congratulations
2763,2020-12-13 14:17:38,the bastion society left virtual reality goggles
2764,2020-12-13 14:17:01,from manufacturernnproduct descriptionnnhardware platform oculus quest  gbnoculus quest advanced allinone vr yet 
2765,2020-12-13 14:16:16,i unmasking truth please read book xexxcposttruthxexxd lee mcintyre comprehension conundrum madeup truths amp virtual reality i wish followers same will open eyes 
2766,2020-12-13 14:15:02,dont worry  walking walls youre virtual reality world longer problem these robotic boots vr users place walk 
2767,2020-12-13 14:14:51,what seeing instead growing mass entertainment like streaming gaming virtual reality this limited pandemic
2768,2020-12-13 14:10:50,virtual reality footmen
2769,2020-12-13 14:10:09,how artificial intelligence impact companynnhow intelligent personal assistants impact customer experience amp use productsservices nnhow virtual reality impact testing products nnhow blockchain alter transactions amp information dissemination
2770,2020-12-13 14:10:01,everyone read book xexxcposttruthxexxd lee mcintyre comprehension conundrum madeup truths amp virtual reality 
2771,2020-12-13 14:04:31,dolphinproject wishing happy new week xfxfxxac if need moments recharge join virtual swim wild dolphins at 
2772,2020-12-13 14:00:18,find smile laugh virtual reality xfxfxxa 
2773,2020-12-13 14:00:01,many activities moved screens pandemic nnbut vr slowly growing popularity hasnt covidinspired spike consumersnnwhat stands way wider adoption virtual realitynn
2774,2020-12-13 13:54:00,sensorium mubert develop aidriven djs virtual reality concerts 
2775,2020-12-13 13:51:16,is future workspace 
2776,2020-12-13 13:49:54,the future insane  sector experiencing immense growth aging the longevity and vitality allows life age  like were  designer babies easy disease whats that virtual amp augmented reality inescapable multiplanetary species done
2777,2020-12-13 13:49:32,vr box virtual reality logo design its modern technologyrelated companiesnnxfxfxx project inquires faq servicesnxfxfxxa cserumancomnskypelivehossainahmedrumannwhatsapp  
2778,2020-12-13 13:42:17,sad reality longterm virtual learning us i sincerely appreciate teachers students parents look forward day connect face face regularly everyday virtually  
2779,2020-12-13 13:39:29,how mad is this i performed new song lucky virtual reality watch here facebook steam song here 
2780,2020-12-13 13:38:46,soul food sunday i challenge virtual church online zoom feed soul xexxcaskxexxd friend zoom ixexxd amp password virtual church queens reality tomorrow letxexxs prepare ourselves xexcxdxefxbxf 
2781,2020-12-13 13:32:10,new review  a rabbit mystic fog steam vr  valve index htc vive oculus rift amp windows mr 
2782,2020-12-13 13:32:00,im fairly certain widespread virtual reality generations
2783,2020-12-13 13:31:00,wishing happy new week xfxfxxac if need moments recharge join virtual swim wild dolphins at 
2784,2020-12-13 13:30:49,amazing sky covered earth looks virtual reality art 
2785,2020-12-13 13:27:31,i run virtual reality dating network where you can have sex marry 
2786,2020-12-13 13:21:02,i run virtual reality dating network where you can have sex marry  newsweek 
2787,2020-12-13 13:19:56,virtual reality spend time working holograms 
2788,2020-12-13 13:18:00,ar enterprise market reach  billion revenue 
2789,2020-12-13 13:17:34,vr virtual reality glasses headsetnnn nn 
2790,2020-12-13 13:17:30,he builds platform virtual reality wins gamennhe builds platform augmented reality controls worldnnthese realities existnnthey scaled yet
2791,2020-12-13 13:15:15,yeah its mum shes virtual reality shes dead
2792,2020-12-13 13:14:53,wouldnt mind virtual reality away shitty actual reality
2793,2020-12-13 13:13:29,i facilitate reality tv style virtual reality
2794,2020-12-13 13:11:13,virtual reality dedication
