,Date,Tweet
842,2020-12-14 18:50:37,forget lets talk dholera the smart cityxfxfxx this way current vikas model going virtual you live virtual reality far away facts
843,2020-12-14 18:50:13,a new project launched university british columbia assistant professor amy parent partnership laxgaltsxexxap village government use virtual reality vr revitalize nisgaxexxa culturennlearn more 
844,2020-12-14 18:49:04,most important fields century individualsnlifeextension technology live yearsnneurotech cybernetic augmentations neural lacenvirtual reality learning entertainmentnnanotech personalized manufacturing resource abundancenthoughts
845,2020-12-14 18:44:56,ahhhh blender i high school virtual reality class for final i juggernog machine call duty black ops zombies got  i went out i wore juggernog shirt xfxfxaxa
846,2020-12-14 18:42:28,okay okay okay i originally planned story ixexxm making alternate dimension video game designer ultimate step virtual reality scrap video game itxexxs actual world katexexxs mom star guardian
847,2020-12-14 18:40:36,challenge everything virtual reality revolutionises digital ill it analytics virtual reality new purpose
848,2020-12-14 18:40:06,key actions help virtual reality 
849,2020-12-14 18:39:48,from himself i hope youre super excited kind virtual reality experience  s nps its compatible 
850,2020-12-14 18:37:48,very good true no packet loss virtual operators sounds far reality
851,2020-12-14 18:37:13,dolphins virtual reality 
852,2020-12-14 18:36:03,they clue they live virtual reality they go darwin natural selection xfxfxxxfxfxxa 
853,2020-12-14 18:35:42,maplewood senior livingxexxs brian geyser value virtual reality 
854,2020-12-14 18:35:16,have imagined future virtual reality well havent plenty authors filmmakers explored concept dont to lets dive popular portrayals virtual future books films ntell favorites comments 
855,2020-12-14 18:34:51,chinese military virtual reality boost combat readiness 
856,2020-12-14 18:33:28,virtual reality air guitar arriving 
857,2020-12-14 18:30:45,fascinated sleep worlds xfxfxxbxfxfxxbxfxfxxb reading s paper morning falling asleep together what makes activities social virtual reality meaningful usersn 
858,2020-12-14 18:26:33,virtual reality
859,2020-12-14 18:26:28,get  oculus rift s enter world virtualxcxareality 
860,2020-12-14 18:26:01,that actually names considered company xfxfxxnnxexxcto translate popular classic irl games immersive virtual reality experiencesxexxdnnwhew ixexxm glad managed whackamole vr first xfxfxx
861,2020-12-14 18:25:06,a versatile sale explodes  bringing mind fierce power spectacular sight  a travel agency marketing firm sports brand virtual reality app fashion label entertainment agency 
862,2020-12-14 18:23:40,the price virtual reality tech going come considerably making accessible everybody google glass start replacing smartphones well incorporate vrar cyber experience 
863,2020-12-14 18:22:34,oculus quest advanced allinone virtual reality headset gb xexx brand new 
864,2020-12-14 18:22:33,oculus rift cv virtual reality headset controllers sensors black 
865,2020-12-14 18:22:33,oculus go virtual reality xcxagb vr headset controller case 
866,2020-12-14 18:21:19,get  oculus rift s enter world virtual reality 
867,2020-12-14 18:20:42,elderly adults reported feeling relaxed rated wellbeing higher engaging vr sessions according study conducted senior care residence minnesotan 
868,2020-12-14 18:20:05,maplewood senior livingxexxs brian geyser value virtual reality 
869,2020-12-14 18:17:56,the guy virtual reality video game
870,2020-12-14 18:17:32,with digital school technical design college dreams designing cities buildings machines transit systems reality students globe comfort home jessa tracy getnn n
871,2020-12-14 18:17:12,winter holidays ski jumping virtual reality 
872,2020-12-14 18:15:53,join friday february  virtual symposium learning virtual world nnconnect amazing lineup educators explore new reality teaching learning math nnvisit information 
873,2020-12-14 18:15:11,a touchless approach relies optical sensors capture motion promises significant leaps forward augmented reality virtual reality arvr environments 
874,2020-12-14 18:14:29,this cool a new virtual reality attraction opening yokohama landmark tower dec nd itxexxll depict scenes chibiusa amp pegasus going city transformation sceneswish this xfxfxxadxfxfxcxxexcxa 
875,2020-12-14 18:14:02,watch sidleyxexxs james oussedik leaders north wall capital alcentra discuss opportunities europe recent xexxc new realityxexxd virtual event 
876,2020-12-14 18:12:06,tomorrow your primary job todayxexxs complex reality successfully join learn hownregister 
877,2020-12-14 18:11:19,we stock amundsen barrel aged dessert in a can virtual reality series nos  please bring face covering come collectnall ltr xcxa ltr xcxa deliverycollection friday please order by thursday lunchtime as this
878,2020-12-14 18:10:55,rave cave operates d virtual reality simulator businesses test products the project uses d visual models create flight paths traffic patterns landing sitesn 
879,2020-12-14 18:10:42,there uses  read article learn popular vr consoles consumers incorporating everyday lives 
880,2020-12-14 18:10:41,virtual reality atmospheric
881,2020-12-14 18:10:16,protective durable case virtual reality vr glasses 
882,2020-12-14 18:10:07,trump magic wand againnnoh wait thing relative realworld matters like vaccines manufacturing jobs this opposed dominion magick ie virtual reality type inalterable things change click button
883,2020-12-14 18:09:52,keeps trapped cycle birth death maya functions similar manner virtual reality goggles blocks outside reality keeping engaged samenmaya pivotal vedic thought translated illusion 
884,2020-12-14 18:09:42,rave cave operates d virtual reality simulator businesses test products the project uses d visual models create flight paths traffic patterns landing sitesn 
885,2020-12-14 18:06:53,its maya ie illusionall virtual realityxfxfxx
886,2020-12-14 18:05:18,d virtual reality glasses phones 
887,2020-12-14 18:05:11,this positive development help improve build law enforcement people need protected 
888,2020-12-14 18:04:03,virtual reality augmented reality tools bringing true effects racism users 
889,2020-12-14 18:01:37,dubbed xexxcaldenxexxs reality the virtual reality concertxexxd project huge success reached audiences world internetnn nvirtual reality concert aldens reality huge hit 
890,2020-12-14 18:00:17,weve tested best virtual reality headsets platforms help figure which any right youxexxb 
891,2020-12-14 17:58:22,how cute but virtual reality playtime shouldnxexxt ahead real job n
892,2020-12-14 17:57:01,follow link view virtual reality tour bedroom semi detached bungalow nunney 
893,2020-12-14 17:56:26,gen yakubu gowon set cadet graduates nigeria defence academy nda th march kaduna nigeriannour virtual reality gallery rich nigeria history xfxfxxxfxfxxa xfxfxxxfxfxxnnwhy check out xfxfxaxnnvisit 
894,2020-12-14 17:56:15,virtual reality tech extremely beneficial seniors 
895,2020-12-14 17:55:43,virtual reality covid mental health crisis  n n 
896,2020-12-14 17:55:12, ability hot chocolate hot apple cidern wheel chairsn walking sticksn magic crystal ballsn tarot cardsn zodiac signsn virtual reality gogglesn smoothie makern modeling careern werewolves n fariesn wedding dressesn lcoachesn getting caught police
897,2020-12-14 17:55:00,its sort like cross escape room virtual reality xfxfxexaenintroducing electric gameboxnn nn
898,2020-12-14 17:54:48,virtual reality tourism education vrte  applying tourism pedagogy multidisciplinary use environmentsn 
899,2020-12-14 17:51:51,as i clarified wife i happy virtual learning working family no asking option away the reality virtual learning work students please previous tweets topic wife take care
900,2020-12-14 17:51:48,i leaders extolling ff bemoaning doesnxexxt work virtually herexexxs reality ground time focus how virtual ff better phase figuring logistically phase figuring culturally most cos starting ecp 
901,2020-12-14 17:49:41,virtual reality visor good high quality xexxholidayxexx destinations vr programme
902,2020-12-14 17:49:28,having virtual xexxcbirthday partyxexxd k pop brush shoulders celebs small business owners shut down shows touch reality guy is xfxfxaxa
903,2020-12-14 17:49:25,advanced version virtual augmented reality 
904,2020-12-14 17:49:06,i present insights case studies breakout session campuses vr virtual reality augmented reality virtual networking virtual classrooms virtual campuses 
905,2020-12-14 17:48:58,vmac  intends focus specifically companies positioned benefit directly growth digitally available content film visual effects animation streaming augmented virtual reality music digital media gaming esports
906,2020-12-14 17:48:05,i virtual reality streamer i play variety games anything call duty type games battle royale games more 
907,2020-12-14 17:47:25,my kid want amp im tryna figure year old needs virtual reality you aint experienced real reality yet 
908,2020-12-14 17:47:09,a virtual friendship turned reality pandemic somethingnn menna i conversing year online random things today met time shared common love freire man pedagogy oppressedxexdxaxexdxa 
909,2020-12-14 17:47:08,any pursuing feelgood story the washington post chemotherapy patient virtual reality bring happy places trying times if so feel free email eanschuetzcom thanks
910,2020-12-14 17:46:06,i virtual reality ps cappathin
911,2020-12-14 17:45:32,in virtual reality 
912,2020-12-14 17:45:29,want land job like scientist  engineer virtual reality amp simulation riverside research applicant tracking systems look specific keywords use right keywords resume hiring manager  ma
913,2020-12-14 17:44:43,maplewood senior livingxexxs brian geyser value virtual reality 
914,2020-12-14 17:44:38,maplewood senior livingxexxs brian geyser value virtual reality 
915,2020-12-14 17:44:33,xfxfxaxxfxfxaxxfxfxxd get  oculus rift s enter world virtual reality oculus rift s  
916,2020-12-14 17:40:49,i super excited play virtual reality festival boxing day december ixexxll joining claude stage this interesting concept  especially timesnntix 
917,2020-12-14 17:40:01,virtual reality allows infinite growth and faster space travel
918,2020-12-14 17:39:43,while offices remain closed travel isnt option companies turning virtual reality bring employees togethernn
919,2020-12-14 17:38:31,take look oculus quest  its standalone unit pc console required 
920,2020-12-14 17:38:17,on jan    pm et trump enablers alternative reality far seats powernnnot confused virtual reality real thing useful
921,2020-12-14 17:37:33,check scene d virtual reality sketchfabnn  th day challenge 
922,2020-12-14 17:37:28,new review  phasmophobia steam vr  valve index htc vive oculus rift amp windows mr 
923,2020-12-14 17:35:50,why first virtual reality art prize is perfect for 
924,2020-12-14 17:33:52,ekwekwala ka dont allow ending reality onnwere igbo learning easy parents amp funducative kids enroll virtual igbo learning program speaking reading amp writing igbo taa todaynnxfxfxxxfxfxfxbe xfxfxxxfxfxfxbe 
925,2020-12-14 17:33:22,todd playing virtual reality best xfxfxaxa
926,2020-12-14 17:31:39,asiaxexxs multimedia star alden richards history highly successful run xexxcaldenxexxs reality the virtual reality concertxexxd xexx staged philippinesnn 
927,2020-12-14 17:31:36,pivoting disrupt shopping lists brands mobile payments virtual reality
928,2020-12-14 17:28:21,tomorrows free virtual event showcases latest virtual augmented mixed reality nn detailsnn n
929,2020-12-14 17:28:00,nearly twothirds executives agree organizations radically transform operations years turning emerging technologies more transformation  
930,2020-12-14 17:25:59,tonight on the news ecstatic dog consumes anime but in virtual reality coming up at 
931,2020-12-14 17:25:11,exploring virtual augmented reality simulation obstetrics gynaecology training qualitative study 
932,2020-12-14 17:25:04,summer social media internshipncbs interactive work remotely help create engaging social media content support reality shows the amazing race survivorn 
933,2020-12-14 17:25:03,blood zeus popular animes year good irregular reconnaissance looks life sea life teenager life trapped virtual reality magic battle fate humanityxexxthe usual stuff 
934,2020-12-14 17:24:21,trains crew virtual reality plans develop vr programs replace theoretical  
935,2020-12-14 17:21:39,z d virtual reality glasses 
936,2020-12-14 17:21:10,nnwe d prototyped virtual reality vr headset clientnn 
937,2020-12-14 17:20:21,learning driver safety doesnt need boring our virtual reality app fully immersive range characters choose help better driving decisions consequences bad choices 
938,2020-12-14 17:20:15,xexacxcxefxbxf virtual reality manipulationnxexacxcxefxbxf spatial manipulationnxexacxcxefxbxf enhanced agilitynxexacxcxefxbxf enhanced durabilitynxexacxcxefxbxf swordsmanship 
939,2020-12-14 17:19:00,older adults nn 
940,2020-12-14 17:18:48,decentraland mana  a virtual reality platform powered by ethereum report 
941,2020-12-14 17:17:46,jhoom india virtual reality conducted  n participated competition fortunately students managed secure position grand xexxfinale event and girl secured position  
942,2020-12-14 17:16:41, why play virtual reality real thing offer inspired  
943,2020-12-14 17:14:26,who needs black mirror realityn
944,2020-12-14 17:11:50,one best digital marketing trends exploded popularity virtual reality vr itxexxs gaining traction especially terms real estate avenue business toonxexxb 
945,2020-12-14 17:11:06,virtual reality matteroffact
946,2020-12-14 17:10:02,oculus rift cv virtual reality headset controllers sensors xexx black 
947,2020-12-14 17:09:43,the phra teamed team penn state students harness vr simulator move support project voting peoples choice award see how nnlink 
948,2020-12-14 17:09:02,acceptance virtual reality headset designed fall prevention older adults questionnaire study 
949,2020-12-14 17:05:43, please vote
950,2020-12-14 17:05:23,virtual reality  o
951,2020-12-14 17:05:11,xcxb k virtual reality gameplay 
952,2020-12-14 17:02:14,i gone bit offpiste week instead reporting cold hard facts i stepped world imaginarynn
953,2020-12-14 17:02:02,verizon teaming simon fuller legendary creator american idol franchise transform storytelling entertainment g virtual reality vr extended reality xr 
954,2020-12-14 17:01:00,a team entered  million partnership create new learning technology train workers efficiently this gamechanging prototype skillkr includes augmented virtual extended reality learn  
955,2020-12-14 17:00:20,this season look different most excitement first remains same call teammates amp dive complete first experience first robotics virtual reality experience powered  enter world first today 
956,2020-12-14 17:00:10,virtual reality augmented reality tools bringing true effects racism users 
957,2020-12-14 16:59:26,inspired short blog post vr research  our team developed program induce anxiety walking better understand emotional contributions older adult falls enjoy n
958,2020-12-14 16:58:08,playing retro pc games virtual realityn 
959,2020-12-14 16:57:22,any educators interested or using virtual reality teaching ive begun work develop vr stem games seeking testers collaborators
960,2020-12-14 16:56:32,what world live in weve virtual reality complements it geniuses alternative reality complements trump amp co while fascinating social experiment i look forward rejoining reality reality soon
961,2020-12-14 16:51:19,facebook accused squeezing rival startups virtual realitynn
962,2020-12-14 16:50:16,view master virtual reality headset 
963,2020-12-14 16:50:10,online virtual events reality lot folks while lot stopgap solution as discovered theres lots learn comes help it 
964,2020-12-14 16:49:07,regional manager jeremy nakashima pe joined s podcast discuss is designing pump stations more click start listening 
965,2020-12-14 16:48:58,new review  automata break steam vr  valve index htc vive oculus rift amp windows mr 
966,2020-12-14 16:42:49, s virtual reality platform seniors transitions hardware choice xexxs g k enterprise headset 
967,2020-12-14 16:42:13,concur i interview week high mighty parker i main proofs detailall thats left actual virtual reality alien art nnpart 
968,2020-12-15 18:33:02,verizon teaming simon fuller legendary creator american idol franchise transform storytelling entertainment g virtual reality vr extended reality xr 
969,2020-12-15 18:32:45,for months cbne speakers going chat virtual reality breaking through  nregister today 
970,2020-12-15 18:30:36,support local restaurateurs order meal togo visit chef amar santana ahmed labatte the hall global eatery south coast plaza we honored and stuffed support october my virtual reality event 
971,2020-12-15 18:30:22,finding difficult motivated student leaders students engaged change things up offer great virtual field trip connect w leaders statewide 
972,2020-12-15 18:29:38,apm terminals begins exploring virtual augmented reality technologies  container management 
973,2020-12-15 18:28:45,thunderbird school global management asu celebrates december nnnn
974,2020-12-15 18:28:15,why i getting who follow suggestion peoplecompanies related vr virtual reality 
975,2020-12-15 18:26:01,virtual reality cooking sim wise manicurists 
976,2020-12-15 18:25:28,virtual reality the demo plug baby good god damn
977,2020-12-15 18:24:49,i wonder virtual reality if pay best buy apple watch you receive apple watch pod for
978,2020-12-15 18:24:45,check latest article dshs launches virtual reality training develop patient empathy western state hospital n 
979,2020-12-15 18:22:24,sometimes just drink effects download app outcome drinkdriving fully immersive virtual reality 
980,2020-12-15 18:21:48,check videos  students able xexxcvirtualxexxd mazes reality 
981,2020-12-15 18:17:29,we want  virtual reality
982,2020-12-15 18:16:25,virtual reality fall guys
983,2020-12-15 18:15:44,it come eventually i cinema i safely especially vip theatreamp i tried new virtual reality experience there cinema duplicate else same goes drivein
984,2020-12-15 18:14:50,it interesting ideas dovetail technocrats augmentedvirtual reality saw linkedin feed 
985,2020-12-15 18:11:00,virtual reality applied rehabilitation stroke neurodegenerative disease patients 
986,2020-12-15 18:10:51,virtual reality squire
987,2020-12-15 18:10:49,check activity line up nnsip amp paintngames virtual realitynpartynstar performances nbody art tattoonfashion popup xexxfree youthxexxnn 
988,2020-12-15 18:10:01,amy parent noxs tsxexxaawit professor  discussed work revitalizing nisgaxexxa culture virtual reality n
989,2020-12-15 18:09:21,dreams weird wtf like virtual reality bc ur experiencing real
990,2020-12-15 18:08:31,todays stream well playing phasmophobia virtual realitynevery donation charity chance jump scare phasmophobia sounds xfxfxxad xfxfxxadnits good cause nxexxa attacknxexxa strong attacknxexxa groannxexxa heartbeat 
991,2020-12-15 18:07:26,please donxexxt forget internet fun virtual reality actual reality donxexxt blend two the expectations internet real life
992,2020-12-15 18:07:15,way term virtual reality emerged consensorium i celebrating ancient power amp mysterious joy music xfxfxexbc xfxfxaxbxfxfxexbxfxfxxf
993,2020-12-15 18:07:02,new virtual reality projects allow people experience racism firsthand 
994,2020-12-15 18:06:49,stop staring clock day its time new career follow view jobs titles like security officer virtual reality labs washington dc 
995,2020-12-15 18:04:52,maplewood senior living has embraced vr tech 
996,2020-12-15 18:04:32,xfxfxxabrand newxfxfxxa oculus quest allinone virtual reality headset gb 
997,2020-12-15 18:02:00,i covered channels recently think usually beneficial workshops xexxchow virtual workshops better realityxexxd 
998,2020-12-15 18:01:32,oculus quest fanfavorite virtual reality pvp shooter blaston now available steam 
999,2020-12-15 18:00:37,professor loved virtual reality final feeling accomplished hire me
1000,2020-12-15 18:00:33,i assume theyxexxre virtual reality worlds
1001,2020-12-15 18:00:32,our amazing virtual reality technology allow view home changes time day season season dream warmer days schedule virtual reality tour 
1002,2020-12-15 18:00:01,new virtual reality program developed collaboration offers employers new way help employees cope toll ongoing stressnn 
1003,2020-12-15 17:59:23,vr virtual reality glasses headsetnn 
1004,2020-12-15 17:59:01,patients helped virtual realitybased rehab 
1005,2020-12-15 17:57:16,this i like imagine middle day virtual school writing house stuff wfh much better reality 
1006,2020-12-15 17:56:09,when fast break away come back do break away prepare return better equipped does defeat initial purpose cleansing is instant gratification awaiting audience virtual reality
1007,2020-12-15 17:55:08,let virtual reality room fists dudes
1008,2020-12-15 17:53:05,virtual reality currently better actual reality
1009,2020-12-15 17:52:42,dr vamsi krishna says xexxs new training programme provided team xexxcthe experience cath lab understanding oct technology quickly efficientlyxexxdnn
1010,2020-12-15 17:52:33,xexx virtual reality effective training lucid dreaming according scientific study a lucid dream youre aware fact youre dreaming control happens its powerful skill developxexxa xexxaa xexxa 
1011,2020-12-15 17:52:06,check clients newest offering vsummits highlighted  the platform designed augment reality provide enhanced nearly physically present user experiencennfull story here 
1012,2020-12-15 17:51:41,augmented reality virtual reality 
1013,2020-12-15 17:51:19,in william gibson published neuromancer this novel written typewriter i add represented cyberspace generated space battles adventures took place at time jaron lanier coined term virtual reality 
1014,2020-12-15 17:48:00,from sms to virtual reality education for all kinds of students forbes india xexx 
1015,2020-12-15 17:46:04,save amp ultimate virtual reality gaming experience 
1016,2020-12-15 17:45:35,our paper titled xexxchow developers optimize virtual reality applications a study optimization commitsxexxd accepted  thanks wonderful coauthors preprint coming soonn
1017,2020-12-15 17:45:22,the activity line nsip paintngames virtual reality partynstar performancesnbody art tottoosnfashion pop xexxcfree youthxexxdnth december xfxfxxaxfxfxxaxfxfxxaxfxfxxaxfxfxxa 
1018,2020-12-15 17:44:53,interesting fact xfxfxaxnnwhile culture believe its rude xfxfxaxab look the nigeria customary look someones eyesnnmore interesting facts xfxfxx click 
1019,2020-12-15 17:42:45,the activity line nsip paintngames virtual reality partynstar performancesnbody art tottoosnfashion pop free younth december xfxfxxaxfxfxxaxfxfxxaxfxfxxaxfxfxxa 
1020,2020-12-15 17:41:00,im virtual reality streamer i original content
1021,2020-12-15 17:40:10,yours truly augmented amp virtual reality   business update 
1022,2020-12-15 17:39:11,thursday bill gates creates virtual reality nightclubs accessible windows
1023,2020-12-15 17:35:03, environments great potential expanding access best learning principles possible says  chief science officer strivrnnmore benefit remote workers  
1024,2020-12-15 17:34:34,virtual reality effective training lucid dreaming according scientificxcxastudy 
1025,2020-12-15 17:34:18,the activity line nsip paintngames virtual reality partynstar performancesnbody art tottoosnfashion pop free younth december xfxfxxaxfxfxxaxfxfxxaxfxfxxaxfxfxxa 
1032,2020-12-15 17:30:39,yeah i got too cyberpunk day the third bynyet continuation harassed puppy gonks murder virtual reality njoin hashtags anywayn
1994,2020-12-14 16:42:11,virtual reality
1995,2020-12-14 16:42:02,virtual reality bluetooth gamepad 
1996,2020-12-14 16:42:00,vitas atampt exploring virtual reality technology hospice care 
1997,2020-12-14 16:40:54,buy now oculus quest xexx advanced allinone virtual reality headset xexx gb 
1998,2020-12-14 16:39:20,awesome work  vr teach experience racism highlighted todays story n
1999,2020-12-14 16:38:22,thunderbird school global management asu celebrates december graduates virtual reality avatar r 
2000,2020-12-14 16:38:02,verizon teaming simon fuller legendary creator american idol franchise transform storytelling entertainment g virtual reality vr extended reality xr  
2001,2020-12-14 16:38:01,the italian gallery  virtual reality private view  click 
2002,2020-12-14 16:36:30,what developers alyx worked game setting new bar virtual reality giving smooth experience way vr pretty new huge achievement huge disappointment award
2003,2020-12-14 16:35:36,promark virtual reality drone pvr review 
2004,2020-12-14 16:30:55,a small christmas gift myself ixexxm making moves yxexxall making moves virtual court reality check 
2005,2020-12-14 16:30:49,this wonderfulnnits vr virtual reality tour shipnnyou enjoy watch standing dont sit watchnnwhile standing slowly rotate self point you beautiful degree view entire ship sea automatically
2006,2020-12-14 16:30:48,new review  a shopping trip eklan tor steam vr  htc vive amp oculus rift 
2007,2020-12-14 16:30:38,strongest application notice impactful way learning history method benefits customer facing roles 
2008,2020-12-14 16:30:26,robotic pets smart toilets virtual reality goggles the masonic homes california committed cutting edge advanced elder care nerve center hitech gadgetrynnread more 
2009,2020-12-14 16:28:00,great research motion sickness virtual reality excellent potential creating comfortable experience struggle common issue vr 
2010,2020-12-14 16:21:43,whwhat no meant virtual reality
