,Date,Tweet
3644,2020-12-12 01:50:37,i adopted years ago march today virtual stranger  distant cousin reality mother me i brothers too prayer answered xexdxaxefxbxf
3645,2020-12-12 01:50:01,thomas mann irvine welsh virtual reality
3646,2020-12-12 01:48:34,ive long excited idea virtual reality this isnt i mind 
3647,2020-12-12 01:44:56,mfs gone fucking virtual reality shit soon
3648,2020-12-12 01:41:31,hello puppets virtual reality game review 
3649,2020-12-12 01:37:13,social media like virtual reality mind experience physical technology makes mental
3650,2020-12-12 01:33:26,apex offers attractions fun ages activities like indoor go karting bowling laser tag escape rooms ropes courses arcade redemption sports simulators axe throwing mini golf bumper cars virtual reality stateoftheart event meeting space
3651,2020-12-12 01:30:41,come join dickens research row sun  noon pt each tour unique come bring friend virtual reality historical simulation starts 
3652,2020-12-12 01:24:04,terminology tuesday virtual reality vr 
3653,2020-12-12 01:20:27,just learned dvirtual reality feature iphones
3654,2020-12-12 01:20:14,enjoyed petrichor  timely trippy virtual reality dance show not live theatre socially distanced oh fake gods great watching creative meet good friends brief moment
3655,2020-12-12 01:17:38,give virtual reality goggles
3656,2020-12-12 01:17:35,sky premier league live vr weekend 
3657,2020-12-12 01:17:13,that virtual reality junk real
3658,2020-12-12 01:15:03,oculus quest gb allinone virtual reality headset 
3659,2020-12-12 01:15:02,samsung gear vr oculus virtual reality headset note s s edge wht 
3660,2020-12-12 01:13:17,in years elephants virtual reality so happy what funfilled time be what next xfxfxdxaxfxfxfxxfxfxexxfxfxcxa
3661,2020-12-12 01:13:17,virtual reality implemented cinema museums  wouldnt like time travel able vr visualize ancient cities there
3662,2020-12-12 01:10:42,virtual reality springs
3663,2020-12-12 01:10:24,nu op kink dna dirty denims  virtual reality 
3664,2020-12-12 01:06:20,room force like ability bend laws reality simply youxexxre cartoon edd edd eddy looney toons animaniacs etc kirby powers similar that
3665,2020-12-12 01:05:38,valiant twitter eff marxists warriors big mouthed virtual life fleeing runaway cowards reality life 
3666,2020-12-12 01:04:57,the robots controlled human virtual reality xfxfxaxafxfxfxbx 
3667,2020-12-12 01:00:21,in reality lack access technology wifi major issue lowincome students country 
3668,2020-12-12 00:59:32,sky premier league live vr weekend 
3669,2020-12-12 00:59:20,why teleportation makes sense virtual reality xexxxexxa
3670,2020-12-12 00:56:14,virtual reality 
3671,2020-12-12 00:54:05,virtual reality vibes advanced med scholars performing surgery simulations xfxfxaxa xexaxxefxbxf nnxfxfxxb advanced medicine amp health care campus johns hopkins 
3672,2020-12-12 00:46:22,nova degree motion virtual reality simulator 
3673,2020-12-12 00:44:21, live world things free appear enchantmenttechnovirtual then price high reality ultimately enough
3674,2020-12-12 00:42:03,not single contest kirby canonically nnkirby is universe hes elemental keeps reality collapsing itself nnkirby basically jesus god split son good bad half
3675,2020-12-12 00:40:07,virtual jigs virtual reality game show nhope things look amp soon xexdxaxfxfxxb
3676,2020-12-12 00:36:30,the popular anthology series addressed gaming multiple episodes including forays augmented virtual reality pocket dimensions chooseyourownadventure style film tracking development s video game bandersnatch 
3677,2020-12-12 00:34:16,great argument im retarded great youre free return virtual reality bye bye
3678,2020-12-12 00:33:38,quality sense ian goddard  testing virtual reality software abstracta 
3679,2020-12-12 00:32:31,virtual reality market places worlds
3680,2020-12-12 00:31:25,improve employee performance with virtual reality training vr 
3681,2020-12-12 00:30:04,in lauren cardenasxexx xexxcxcxboamericano inflight mealxexxd photos taken airplane windows transposed cheese slices offering wry commentary desire amp reality american dream amp search new horizons view virtual exhibition 
3682,2020-12-12 00:27:09,i want buy land government away build big ass art space theatre exhibitions games virtual reality shit horror hip hop political shit i juuuuust 
3683,2020-12-12 00:26:26,check meet shanta my virtual reality asmr reading cardsmeditation guru 
3684,2020-12-12 00:25:04,bow valley college practical nursing students use cuttingedge virtual reality technology prepare reallife patients learn vr avatars work  
3685,2020-12-12 00:24:38,check meet shanta my virtual reality asmr reading cardsmeditation guru 
3686,2020-12-12 00:23:46,david cronenbergs existenz  focuses exploring virtual reality headsets replaced biotechnological game pods line realities significantly blurred spielbergs gamified version 
3687,2020-12-12 00:23:44,but thingsxexxxexxhow seen future gaming spaces interpreted big screennnsteven spielbergs adaptation ready player one  centers virtual reality platform serves digital nexus video game film amp pop culture references 
3688,2020-12-12 00:21:01,security officer virtual reality labs at allied universal xcxae security professionals assist clients public large providing essential jobs communities safe secure during time need help thanxexxa 
3689,2020-12-12 00:18:29,this cobrainspired autonomous bike tailored hairraising virtual reality racing 
3690,2020-12-12 00:15:54,zerone vr virtual reality glasses  wearyourowntechs 
3691,2020-12-12 00:14:08,full virtual reality
3692,2020-12-12 00:13:06,virtual reality sewell
3693,2020-12-12 00:11:21,of mass production mass sales period reality live society economy supported virtual things
3694,2020-12-12 00:08:20,i know reality trump won nd inauguration th biden fake ass virtual inauguration
3695,2020-12-12 00:06:02,nrefast tracking covid eradication by utilising hbot for uk victimsn virtual reality video nthe effect coronavirus victims temporary mild earache 
3696,2020-12-12 00:04:01,virtuo buy  developed virtual reality fun convert ar 
3697,2020-12-12 00:02:32,this cobrainspired autonomous bike tailored hairraising virtual reality racing 
3698,2020-12-12 00:01:58,augmented virtual reality magazine 
3699,2020-12-12 00:00:58,coming up on the news confused woman hides from anime but in virtual reality more at 
3700,2020-12-11 23:59:35,ive counting guffaw tweets thank virtual therapist lol
3701,2020-12-11 23:59:20,lan y j  immersion interaction experienceoriented learning bringing virtual reality fl learning language learning amp technology  xexx 
3702,2020-12-11 23:57:44,thank you funeral today virtual most what sad reality living it didnxexxt way
3703,2020-12-11 23:56:07,my favorite colors red purple pink green  honestly moment favorite place right virtual reality world crazy place friends lately vr haha i like going shiny stuff like gems video games
3704,2020-12-11 23:50:57,ive learnt virtual reality far better place real world 
3705,2020-12-11 23:50:06,i want live world people live real reality virtual one the internet connected separated fell swoop i long days walkin pub expected contactable times
3706,2020-12-11 23:49:22,so fun beta test  silent night this game changer choir directors making virtual choirs reality so exciting 
3707,2020-12-11 23:48:27,either female version sure like man itxexxs point virtual reality submersion
3708,2020-12-11 23:43:15,complexity artificial intelligence simplified software dedicated agribusiness search attempt broaden horizons virtual reality business fits hand 
3709,2020-12-11 23:42:30,first amadepolis virtual reality concert 
3710,2020-12-11 23:39:32,this cobrainspired autonomous bike tailored hairraising virtual reality racing 
3711,2020-12-11 23:39:32,this cobrainspired autonomous bike tailored hairraising virtual reality racing 
3712,2020-12-11 23:36:19,los angeles xexx rebecca volpetti star open borders buongiorno italia aila donovan toplines indepth inspection latest virtual reality erotic fantasies vr bangers 
3713,2020-12-11 23:33:15,paravr virtual reality training simulator paramedic skills maintenance  journal paramedic practice 
3714,2020-12-11 23:30:38,japanese students recreated hiroshima bombing in virtual reality  time 
3715,2020-12-11 23:30:10,thanks augmented reality mobile arcade turns mobile device coolnnshop nowgtgtgt 
3716,2020-12-11 23:29:10,i played resident evil virtual reality mode literally quit mins my nerves shotxfxfxxxfxfxx
3717,2020-12-11 23:27:00,xfxfxex question xfxfxexnnwhatxexxs unrealistic gift wish list nnmine ps virtual reality set xfxfxxxfxfxxnn 
3718,2020-12-11 23:26:17,cyberpunk tragic example happens try deep lack dick donxexxt shove fake tell itxexxs dick  ainxexxt no dick trace no gnosis pure neurosis you need ride on suck dick tell virtual reality 
3719,2020-12-11 23:25:10,virtual reality day going completely life like
3720,2020-12-11 23:24:55,the devil imitate god  look living shit virtual reality xfxfxxb
3721,2020-12-11 23:22:38,join cohosts cynthia amp john episode the paincancer connection interview entrepreneur celine tien development virtual reality app helps manage anxiety stress wellness challenges 
3722,2020-12-11 23:21:03,new gb oculus quest virtual reality box gaming 
3723,2020-12-11 23:15:37,we living virtual reality right now hexexxs setting snl skits
3724,2020-12-11 23:15:05,discover or rediscover inuit prints textiles sculptures art collection nnexplore virtual reality online exhibition xexxcshifting geographies xexxaxexxafxexxbexexxaxexxxexxxexxfxexxa xexxxexxxexxfxexxaxexxd today 
3725,2020-12-11 23:13:12,virtual reality  platform n steam vr 
3726,2020-12-11 23:10:32,virtual reality rapes
3727,2020-12-11 23:10:22,i recently discovered famous artist pioneer virtual reality jonathan winbush created videos powerful unreal engine assets made examples proud creation on 
3728,2020-12-11 23:10:05,intuitive understanding bodymindsoul connection uniquely reality 
3729,2020-12-11 23:09:16,virtual reality  games 
3730,2020-12-11 23:05:25,violette presented partnership jan   intriguing innovative creation ways what expect how performances go is experiment safe current circumstances have look here 
3731,2020-12-11 23:05:14,man jeeze getting vr legs little more still feels weird reality feeling weird virtual reality atm gtgt
3732,2020-12-11 23:05:06,the future virtual reality how we love feeling being immersed different world 
3733,2020-12-11 23:00:42,oooh great question nnneurologist psychiatrist psychologist physical occupational therapists treatment chronic pain  sensory stuff virtual reality brain training mirror work la 
3734,2020-12-11 23:00:03,pandemic slowed virtual reality  its helping connect people surprising  
3735,2020-12-11 23:00:01,are fan the polar express do virtual reality headsets nmake plans attend reading story dec  pm nit place infamous train audience standing floating icebergs 
3736,2020-12-11 22:54:23,just imagine virtual reality thingnoh i feel like badass
3737,2020-12-11 22:54:14,are ready hear xexxcthe envision effectxexxd infinite possibilities health wealth education entertainment xcxaand ecommerce medium virtual reality n 
3738,2020-12-11 22:50:57,today on the news ecstatic town hall worker really doesnt care for anime but in virtual reality coming up at 
3739,2020-12-11 22:49:52,medical college pilots developing physicallydistanced datadriven training vr so stands way wider adoption vr nnthis week a virtual reality check with  david culos s nora maclachlan nxfxfxxa
3740,2020-12-11 22:46:03,calling all calgary parents principals and teachers feeling limited covid experience energy virtual reality field trip bring energy industry classroom book free experience energy vr field trip today email infocom 
3741,2020-12-11 22:40:38,quality sense ian goddard  testing virtual reality software abstracta 
3742,2020-12-11 22:38:32,oculus facebook account row prompts german competition because facebook dominant player social media market germany an important player emerging growing vr virtual reality market 
3743,2020-12-11 22:37:45,los angeles xexx rebecca volpetti star open borders buongiorno italia aila donovan toplines indepth inspection latest virtual reality erotic fantasies vr bangersnduring pandemic countries getting 
3744,2020-12-11 22:36:46,wrapped vr sesh team feel qualified tell virtual reality radically change nature corporate coordination years nnthread xfxfxxnnnot investment advice
3745,2020-12-11 22:36:10,credit union technology watch augmented virtual reality arvr 
3746,2020-12-11 22:33:38,s just dont remember uh alexs vigilante makeup look like drag queen im scared virtual reality obsidian happened dead people vr lenses scared william annoying alex gonna mom
3747,2020-12-11 22:33:02,german regulators launch new facebook investigation virtual reality product oculus 
3748,2020-12-11 22:32:53,a looking ahead continuing reality moved set rules guide student online conduct amp lay penalties amp online abuses 
3749,2020-12-11 22:31:27,if buy virtual reality headset shouldnt forced facebook account
3750,2020-12-11 22:30:33,meet arthur new meeting spacenn
3751,2020-12-11 22:30:11,the company hopes low technical requirements use platform encourage creators try arnnmetavrse will make creating augmented reality apps easier  digital trends 
3752,2020-12-11 22:30:06,i wondering nwo planning convince people stay home shopping work studies online ni think answer hooked virtual reality  instead going experiencing life experience programmed game
3753,2020-12-11 22:24:48,yall probably likennvrnwhat vr meannwell buddynvr meansnnvirtual realitynnimma be playing some fnaf vr ayee
3754,2020-12-11 22:22:41,th century boysnnvolume nnstartedampcompleted december th nn the friend dead hes alive what and virtual reality game too real wonder well game like manga xfxfxax 
3755,2020-12-11 22:20:57,up next on the news famous website developer is pessimistic about anime but in virtual reality coming up at 
3756,2020-12-11 22:19:00,murphy untangled cluster wires pulled virtual reality helmet mess time mystical armor 
3757,2020-12-11 22:17:06,bringing virtual mixed reality technologies innovation offers users d worldxexxpowered smartphone very cool xfxfxaxaf via  
3758,2020-12-11 22:16:05,we need virtual reality app records happens bodies recreate reality bodies theyre trying you need  were left bearing burden months setbacks thing know doesnt work
3759,2020-12-11 22:13:21,in years dogs virtual reality crying what intersting time be what next xfxfxxdxfxfxfxbbxfxfxxxfxfxcxaaxfxfxdxc
3760,2020-12-11 22:11:14,get exclusive peek xefxbxfxexxaxefxbxfxexxaxefxbxfxexxaxefxbxfxexxa year review after unprecedented year team sat reflect shift activities opportunities arose new virtual reality nout week gt 
3761,2020-12-11 22:10:42,virtual reality spooked
3762,2020-12-11 22:09:12,virtual reality health sciences medicine 
3763,2020-12-11 22:08:31,fancy trip legendary yorkshire dales three peaks ingleboroughnnnow leaving living room new google expeditionnnthanks great write n
3764,2020-12-11 22:07:15,fantastic xexxlivin la vida lockdownxexx virtual christmas tonight great job hannie xfxfxcxbxfxfxxfxfxfxxfxfxfxxcxfxfxfxbb hope reality oin xx 
3765,2020-12-11 22:02:02,noni know sound smart single thought have every single thing crossed mindnplus internet gets explore personalities youxexxd like portray wantnlike virtual reality game like sims 
3766,2020-12-11 22:00:08,the family workstations download spec sheet brought bayou city solutions llc inside look workstations power handle complex workloadsxexxincluding virtual reality 
3767,2020-12-11 21:53:12,virtual reality maybee
3768,2020-12-11 21:52:24,the oculus quest will make every guy love virtual reality  
3769,2020-12-11 21:51:57,the year republicans seceded reality xd
3770,2020-12-11 21:48:02,argumentation virtual reality environment approach future physics teachers  ferreira  riedxcxa 
3771,2020-12-11 21:47:25,verizon teaming simon fuller legendary creator american idol franchise transform storytelling entertainment g virtual reality vr extended reality xr 
3772,2020-12-11 21:45:05,farming simulator virtual reality 
3773,2020-12-11 21:43:14,just hours ramble virtual reality new concert tune wild xcxa 
3774,2020-12-11 21:41:51,virtual reality gone wrong kind games weird aesthetic stuff i lovenlsd dream emulatornbroken realitynno thingnoknormal
3775,2020-12-11 21:41:05,this dental implant training program combines instructorled training elearning degree virtual reality experience its great admi recognized innovative learning experiences doctors teams photo taken prepandemic 
3776,2020-12-11 21:40:33,development validation virtual realitybased training program promoting subjective wellbeing development validation virtual realitybased training program promoting subjective wellbeing psychiatry investig dec xexxa 
3777,2020-12-11 21:37:54,yes absolutely thats right i dont dare use living room virtual reality sensors room live streaming xfxfxxxfxfxx
3778,2020-12-11 21:35:30,flipped sharper image catalog time years i words words i apparently way touch reality but everythingxexxs xexxcvirtualxexxd like pingpong arenxexxt they and needs stuff
3779,2020-12-11 21:30:57,today on the news local role player holds anime but in virtual reality coming up at 
3780,2020-12-11 21:30:11,german regulators launched investigation companyxexxs decision link oculus virtual reality products social network authorities said n
3781,2020-12-11 21:30:00,german regulators launched investigation facebook companys decision link oculus virtual reality products social networknn
3782,2020-12-11 21:27:21,virtual real world far difference you virtualitybut challenges common friend realitynn square real world thats virtual world its feetnn nnwill prove again
3783,2020-12-11 21:23:03,allows brands provide customers unique engaging experiences combine xexxrealxexx elements changing game main choices marketsnnthe benefits marketing 
3784,2020-12-11 21:22:32,it like virtual reality version need speed
3785,2020-12-11 21:20:45,here important ways improve nxfxfxxxfxfxfxbc inventory management xfxfxxbe nxfxfxxxfxfxfxbc temperature monitoring xfxfxcxanxfxfxxxfxfxfxbc virtual reality xfxfxax 
3786,2020-12-11 21:16:57,augmented reality  virtual reality in retail marketing luxury digital era   
3787,2020-12-11 21:10:40,virtual reality corroborate
3788,2020-12-11 21:08:23,medal honorxexxs vr spinoff falls apart shooting stops 
3789,2020-12-11 21:06:34,to aunt year buy nephew virtual reality headset orrrr notxfxfxaxa
3790,2020-12-11 21:06:28,after long day work helps relax virtual world away stress jump reality escape everyday stress instacamvr virtual guru meditation find zen instacalm vrn 
3791,2020-12-11 21:04:54,brb getting addicted animal crossing living  virtual reality life
3792,2020-12-11 21:04:26,life virtual reality game
3793,2020-12-11 21:02:57,the virtual reality meditative experience free spirit vr colibri xr gmbh released pcnn 
3794,2020-12-11 21:02:40,ive realised its missing big one marie laure ryans virtual reality book oops ill add im thats i highly recommend
3795,2020-12-11 21:01:32,new oculus quest advanced all in one virtual reality headset gb xexx in hand 
3796,2020-12-11 21:00:38,techbuzz covers james jensen pioneer locationbased virtual reality lbvr optimism newest venture jump research development meetnn 
3797,2020-12-11 21:00:20,the extremely excellent oculus rift s virtual reality headset benefits euros immediate discount if want play differently fully immersed unprecedented experience ocu 
3798,2020-12-11 21:00:00,explore adapting virtual workspaces unique needs developing immersive applications register webinar dec  am pt 
3799,2020-12-11 20:59:03,watching yesterday the experience global the connections virtual events real adapting reality day goes by
3800,2020-12-11 20:53:18,the oculus rift s tethered virtual reality headset  usual price amazon you pick n 
3801,2020-12-11 20:50:40,had wierd lucid dreams night woke dizzy today virtual reality end xx
3802,2020-12-11 20:46:10,have booked virtual flight rovaniemi finland offering firstever virtual reality flight north  n 
3803,2020-12-11 20:45:06,two new virtual reality simulators allow students handson training construction medical fields expensive impractical impossible  
3804,2020-12-11 20:43:52,if edit reality easily amiright stick virtual world youxexxre way fragile reality
3805,2020-12-11 20:43:24,great place hang escape depressing reality pandemicnncome mental health stay virtual table flipping 
3806,2020-12-11 20:40:48,omg bvb virtual concert amazing xfxfxxadxfxfxxad i love much hearing scarlet cross live gorgeous nnthe aftershow pretty awesome too now reality
3807,2020-12-11 20:38:35,it great excitement announce receiving support funded grant development virtual reality  features nn
3808,2020-12-11 20:37:57,the majority time online different reality people obsess having perfect virtual identity putting risk losing real identity struggle mental health meeting standards xexxcpicture perfect life
3809,2020-12-11 20:35:58,deep cleaned ready weekend come socially distanced safe fun whether virtual reality arcades consoles table games bar youre looking weve got covered nndont forget grab gift cards too online store 
3810,2020-12-11 20:34:20,xexaxnencased enthusiasm xexxshe tugged close xexxholding hands dragging interiors shooting game planned virtual reality nnxexxd start  loses pays  xexxenxexxaxexxa
3811,2020-12-11 20:33:02,augmented reality retail industry challenges pandemic virtual fitting room adoption accelerate nn 
3812,2020-12-11 20:31:25,dont forget were hosting vr program naming contest were looking clever encompasses virtual reality arts winner receives  amazon gift card enter december th  mst submit entries here 
3813,2020-12-11 20:27:25,advances augmented virtual reality promise revolutionize workplace these technologies include use avatars digital twins help humanize remote work experience companies hybrid workplace model 
3814,2020-12-11 20:27:22,happy chance present virtual reality solutions europols forensic expert forum 
3815,2020-12-11 20:25:33,virtual reality technology teach genocide iraq nnxexxaaxefxbxf this virtual reality reflection real experience lived through important communities educated aware yazidi people culturenn 
3816,2020-12-11 20:25:04,year people tour parliament buildings ottawa this year experience tour comfort homennto learn new virtual reality experience visit 
3817,2020-12-11 20:24:54,she loves virtual reality chesterfield county virginia 
3818,2020-12-11 20:20:29,game changing virtual reality console hits thexcxamarket 
3819,2020-12-11 20:20:06,come te hxcxpua halswell centre celebrate halswell therell crafts games christmas themed storytimes virtual reality christmas photobooth robots tech sausage sizzle more santa arriving pmn mt 
3820,2020-12-11 20:18:42,children studying course use wonderful set virtual reality world created real world backgroundnn what augmented realitynn 
3821,2020-12-11 20:15:57,i think therexexxs massive empathy gap driving this men women failing imagine pain suffer life relationships maybe technological help a virtual reality experience highlights gendersxexx challenges offers solutions
3822,2020-12-11 20:14:01,due deconditioning long covid ive telephone physiotherapy consultations with exercises sent email afterwards  i think better i met physio virtual reality seen exercises them
3823,2020-12-11 20:13:47,virtual reality amp training why immersive environments create greater engagement 
3824,2020-12-11 20:12:15,they want enslavementnonce enslaved medicated proceed partial depopulationnthan want connect digital slaves virtual reality enslave minds phisical waynfor sinister reasonsnthose simple people
3825,2020-12-11 20:11:02,virtual reality clatter
3826,2020-12-11 20:09:22,transforming remote learning vr amp bringing virtual reality courses 
3827,2020-12-11 20:07:44,mark calendar lai games live inperson help location owners plan  were sponsoring panel covids impact locationbased virtual reality missednn
3828,2020-12-11 20:05:08,saor alba xexxitxexxs virtual realityxexxnnfilming today scottish people canxexxt rap vr film 
3829,2020-12-11 20:05:07,finding early success virtual reality technology remotely train medical students pandemic 
3830,2020-12-11 20:04:47,just finished watch virtual amzing  from performance lights thankful band step live reality everyonew
3831,2020-12-11 20:02:41,are happy  whats promising thing youve working virtual reality environment are involved facilitator different role thanks
3832,2020-12-11 20:01:30,virtual realityanother team google meets meeting books xfxfxxa 
3833,2020-12-11 19:58:55,htc vive cosmos elite virtual reality systemn
3834,2020-12-11 19:58:22,havenxexxt worn glasses nearly century they donxexxt look good vampires i figured but i compelled grab pair again itxexxs like virtual reality they bit hideous though i time selecting pair
3835,2020-12-11 19:57:30,oh its hell im coping virtual reality app called narcissismdynamo creates realistic environment ass kissing suck ups feels good real undeserved worship i miss much xfxfxaxb
3836,2020-12-11 19:55:39,virtual life making millions mopping floorsnnreality millions mopping floors
3837,2020-12-11 19:54:26,virtual reality ultra immersive gameplaynnthat gets ruined single time movennpoints laser teleportsnnwow its like im there
3838,2020-12-11 19:54:18,special yr shared lose authentic self virtual reality finally learn carrying on
3839,2020-12-11 19:53:54,hii ru t mobile client if u pls dm me i need code justin bieberxexxs virtual concertxexdxaxefxbxf
